{
  "schema_version": "0.1.0",
  "fact_coverage_snapshot_id": "fact_coverage_snapshot_87ad2fa54e8ab7f7543c1ce3",
  "corpus_snapshot_id": "corpus_04750795e1a2d5c3",
  "semantic_bundle_schema_version": "0.2.0",
  "producer_version": "seed-turn-m7-promotion",
  "created_at": "2026-08-16T03:57:06.124Z",
  "slots": [
    {
      "slot_key": "question_seed_v07_01::contract_amount",
      "corp_code": "00164645",
      "metric_code": "CONTRACT_AMOUNT",
      "period_key": "as_of:2023-04-28",
      "scope": "COMPANY",
      "coverage_state": "ALL_REQUIRED_FACT_SLOTS_VERIFIED",
      "verification_status": "VERIFIED",
      "fact_ids": [
        "fact_3119bfad2317adbd818a3b6a"
      ],
      "evidence_ids": [
        "evidence_4fe3a16a319853c394fd205b"
      ],
      "reason_code": null
    },
    {
      "slot_key": "question_seed_v07_02::investment_amount",
      "corp_code": "00111704",
      "metric_code": "INVESTMENT_AMOUNT",
      "period_key": "as_of:2025-04-28",
      "scope": "COMPANY",
      "coverage_state": "ALL_REQUIRED_FACT_SLOTS_VERIFIED",
      "verification_status": "VERIFIED",
      "fact_ids": [
        "fact_5f6fa474ce3099876b32e4c5"
      ],
      "evidence_ids": [
        "evidence_1a5a2657f50d91751f296525"
      ],
      "reason_code": null
    },
    {
      "slot_key": "question_seed_v07_04::holding_shares",
      "corp_code": "00126380",
      "metric_code": "HOLDING_SHARES",
      "period_key": "as_of:2025-01-24",
      "scope": "COMPANY",
      "coverage_state": "ALL_REQUIRED_FACT_SLOTS_VERIFIED",
      "verification_status": "VERIFIED",
      "fact_ids": [
        "fact_dfea5c2460a47ebfb7a3da9e"
      ],
      "evidence_ids": [
        "evidence_ed2a3eb575a695dbeb6279f5"
      ],
      "reason_code": null
    },
    {
      "slot_key": "question_seed_v07_04::holding_ratio",
      "corp_code": "00126380",
      "metric_code": "HOLDING_RATIO_PERCENT",
      "period_key": "as_of:2025-01-24",
      "scope": "COMPANY",
      "coverage_state": "ALL_REQUIRED_FACT_SLOTS_VERIFIED",
      "verification_status": "VERIFIED",
      "fact_ids": [
        "fact_78de280b6df99b27155a99d6"
      ],
      "evidence_ids": [
        "evidence_b005610e9425a278ca531afd"
      ],
      "reason_code": null
    },
    {
      "slot_key": "question_seed_v07_05::disposal_shares",
      "corp_code": "00190321",
      "metric_code": "DISPOSAL_SHARES",
      "period_key": "as_of:2026-01-20",
      "scope": "COMPANY",
      "coverage_state": "ALL_REQUIRED_FACT_SLOTS_VERIFIED",
      "verification_status": "VERIFIED",
      "fact_ids": [
        "fact_8e743004b00dd97454e6f59b"
      ],
      "evidence_ids": [
        "evidence_7a22d6ae73a79a826710b025"
      ],
      "reason_code": null
    },
    {
      "slot_key": "question_seed_v07_06::dock_investment_amount",
      "corp_code": "00111704",
      "metric_code": "INVESTMENT_AMOUNT",
      "period_key": "as_of:2025-04-28",
      "scope": "COMPANY",
      "coverage_state": "ALL_REQUIRED_FACT_SLOTS_VERIFIED",
      "verification_status": "VERIFIED",
      "fact_ids": [
        "fact_7c4d7fb184e153896c1c44af"
      ],
      "evidence_ids": [
        "evidence_1b42bdcc4dc7440cc6e4a340"
      ],
      "reason_code": null
    },
    {
      "slot_key": "question_seed_v07_06::crane_investment_amount",
      "corp_code": "00111704",
      "metric_code": "INVESTMENT_AMOUNT",
      "period_key": "as_of:2025-04-28",
      "scope": "COMPANY",
      "coverage_state": "ALL_REQUIRED_FACT_SLOTS_VERIFIED",
      "verification_status": "VERIFIED",
      "fact_ids": [
        "fact_5f6fa474ce3099876b32e4c5"
      ],
      "evidence_ids": [
        "evidence_1a5a2657f50d91751f296525"
      ],
      "reason_code": null
    },
    {
      "slot_key": "question_seed_v07_07::event_status",
      "corp_code": "00413046",
      "metric_code": "EVENT_STATUS",
      "period_key": "as_of:2025-02-17",
      "scope": "COMPANY",
      "coverage_state": "ALL_REQUIRED_FACT_SLOTS_VERIFIED",
      "verification_status": "VERIFIED",
      "fact_ids": [
        "fact_a26e82741420803951081c59"
      ],
      "evidence_ids": [
        "evidence_2f82f7c9dd5d8b666d4ea489"
      ],
      "reason_code": null
    },
    {
      "slot_key": "question_seed_v07_07::launch_status",
      "corp_code": "00413046",
      "metric_code": "LAUNCH_STATUS",
      "period_key": "as_of:2025-12-31",
      "scope": "COMPANY",
      "coverage_state": "ALL_REQUIRED_FACT_SLOTS_VERIFIED",
      "verification_status": "VERIFIED",
      "fact_ids": [
        "fact_d5454eb70ca900df8f82da9e"
      ],
      "evidence_ids": [
        "evidence_f6596ad0db1c7cad3a4147f5"
      ],
      "reason_code": "SCOPE_IS_FIVE_PRODUCT_GROUP_NOT_PRODUCT_SPECIFIC"
    },
    {
      "slot_key": "question_seed_v07_08::event_decision_content",
      "corp_code": "00126380",
      "metric_code": "EVENT_DECISION_CONTENT",
      "period_key": "as_of:2024-11-15",
      "scope": "COMPANY",
      "coverage_state": "ALL_REQUIRED_FACT_SLOTS_VERIFIED",
      "verification_status": "VERIFIED",
      "fact_ids": [
        "fact_1152c0d605118ea9eef3de0f"
      ],
      "evidence_ids": [
        "evidence_f5e63066232ca0bd0e02bd29",
        "evidence_15875a167f87fdac66704231",
        "evidence_4ca2e43be9f63350f31867a9"
      ],
      "reason_code": null
    },
    {
      "slot_key": "question_seed_v07_08::acquisition_retirement_status",
      "corp_code": "00126380",
      "metric_code": "ACQUISITION_RETIREMENT_STATUS",
      "period_key": "as_of:2025-06-30",
      "scope": "COMPANY",
      "coverage_state": "ALL_REQUIRED_FACT_SLOTS_VERIFIED",
      "verification_status": "VERIFIED",
      "fact_ids": [
        "fact_e5ad6617ee0e6287fb222ce3"
      ],
      "evidence_ids": [
        "evidence_d9a8ecf2e22c076c8c200aa0"
      ],
      "reason_code": null
    },
    {
      "slot_key": "question_seed_v07_09::event_decision_content",
      "corp_code": "00382199",
      "metric_code": "EVENT_DECISION_CONTENT",
      "period_key": "as_of:2025-02-06",
      "scope": "COMPANY",
      "coverage_state": "ALL_REQUIRED_FACT_SLOTS_VERIFIED",
      "verification_status": "VERIFIED",
      "fact_ids": [
        "fact_ae59c05c37847e6d6cdbf143"
      ],
      "evidence_ids": [
        "evidence_bcb37279ae1fd1edb409c064",
        "evidence_df234bf52adff5e717a30b87"
      ],
      "reason_code": null
    },
    {
      "slot_key": "question_seed_v07_09::termination_status",
      "corp_code": "00382199",
      "metric_code": "TERMINATION_STATUS",
      "period_key": "as_of:2025-06-23",
      "scope": "COMPANY",
      "coverage_state": "ALL_REQUIRED_FACT_SLOTS_VERIFIED",
      "verification_status": "VERIFIED",
      "fact_ids": [
        "fact_42f0a6ea3935a97e95a66b06"
      ],
      "evidence_ids": [
        "evidence_d2e257c56114cbb8f8585f73",
        "evidence_9fa1aaf64e0114f6a09d0372"
      ],
      "reason_code": null
    },
    {
      "slot_key": "question_seed_v07_09::acquisition_retirement_status",
      "corp_code": "00382199",
      "metric_code": "ACQUISITION_RETIREMENT_STATUS",
      "period_key": "as_of:2025-06-30",
      "scope": "COMPANY",
      "coverage_state": "ALL_REQUIRED_FACT_SLOTS_VERIFIED",
      "verification_status": "VERIFIED",
      "fact_ids": [
        "fact_ae09fd5e300fe1c1d27502ab"
      ],
      "evidence_ids": [
        "evidence_53272415be8c7c695d6fea7e"
      ],
      "reason_code": null
    },
    {
      "slot_key": "question_seed_v07_10::revenue_2023",
      "corp_code": "00302926",
      "metric_code": "REVENUE",
      "period_key": "half:2023_06",
      "scope": "CONSOLIDATED",
      "coverage_state": "ALL_REQUIRED_FACT_SLOTS_VERIFIED",
      "verification_status": "VERIFIED",
      "fact_ids": [
        "fact_d5a64524e98d02df830ae13c"
      ],
      "evidence_ids": [
        "evidence_68032d71581d2cbee3fc2eaf"
      ],
      "reason_code": null
    },
    {
      "slot_key": "question_seed_v07_10::revenue_2025",
      "corp_code": "00302926",
      "metric_code": "REVENUE",
      "period_key": "half:2025_06",
      "scope": "CONSOLIDATED",
      "coverage_state": "ALL_REQUIRED_FACT_SLOTS_VERIFIED",
      "verification_status": "VERIFIED",
      "fact_ids": [
        "fact_42e2e830c5a832b87c0e3b30"
      ],
      "evidence_ids": [
        "evidence_de7be27c8aa2cde645113826"
      ],
      "reason_code": null
    },
    {
      "slot_key": "question_seed_v07_10::operating_profit_2023",
      "corp_code": "00302926",
      "metric_code": "OPERATING_PROFIT",
      "period_key": "half:2023_06",
      "scope": "CONSOLIDATED",
      "coverage_state": "ALL_REQUIRED_FACT_SLOTS_VERIFIED",
      "verification_status": "VERIFIED",
      "fact_ids": [
        "fact_e265871331b293f4e59f7479"
      ],
      "evidence_ids": [
        "evidence_f193fc659ec1abcd33b8c46b"
      ],
      "reason_code": null
    },
    {
      "slot_key": "question_seed_v07_10::operating_profit_2025",
      "corp_code": "00302926",
      "metric_code": "OPERATING_PROFIT",
      "period_key": "half:2025_06",
      "scope": "CONSOLIDATED",
      "coverage_state": "ALL_REQUIRED_FACT_SLOTS_VERIFIED",
      "verification_status": "VERIFIED",
      "fact_ids": [
        "fact_e33916d5a71070a7009dd196"
      ],
      "evidence_ids": [
        "evidence_5c85f81dbc43177fdbac6573"
      ],
      "reason_code": null
    },
    {
      "slot_key": "question_seed_v07_11::revenue_2023",
      "corp_code": "00164645",
      "metric_code": "REVENUE",
      "period_key": "annual:2023_12",
      "scope": "CONSOLIDATED",
      "coverage_state": "ALL_REQUIRED_FACT_SLOTS_VERIFIED",
      "verification_status": "VERIFIED",
      "fact_ids": [
        "fact_33f22cfa82829dc439a82dc5"
      ],
      "evidence_ids": [
        "evidence_bad097c7974d2ae142d1ea1e"
      ],
      "reason_code": null
    },
    {
      "slot_key": "question_seed_v07_11::revenue_2025",
      "corp_code": "00164645",
      "metric_code": "REVENUE",
      "period_key": "annual:2025_12",
      "scope": "CONSOLIDATED",